{
  "schema_version": "1.0",
  "generated_at": "1970-01-01T00:00:00Z",
  "data_status": "sample",
  "series": {
    "granularity": "daily_global_mean",
    "unit": "celsius",
    "train_end": "2023-03-31",
    "test_window_days": 30,
    "history": [
      {
        "date": "2023-01-01",
        "value": 16.03
      },
      {
        "date": "2023-01-02",
        "value": 16.33
      },
      {
        "date": "2023-01-03",
        "value": 16.61
      },
      {
        "date": "2023-01-04",
        "value": 16.84
      },
      {
        "date": "2023-01-05",
        "value": 17.03
      },
      {
        "date": "2023-01-06",
        "value": 17.14
      },
      {
        "date": "2023-01-07",
        "value": 17.19
      },
      {
        "date": "2023-01-08",
        "value": 17.19
      },
      {
        "date": "2023-01-09",
        "value": 17.13
      },
      {
        "date": "2023-01-10",
        "value": 17.04
      },
      {
        "date": "2023-01-11",
        "value": 16.94
      },
      {
        "date": "2023-01-12",
        "value": 16.86
      },
      {
        "date": "2023-01-13",
        "value": 16.81
      },
      {
        "date": "2023-01-14",
        "value": 16.8
      },
      {
        "date": "2023-01-15",
        "value": 16.86
      },
      {
        "date": "2023-01-16",
        "value": 16.99
      },
      {
        "date": "2023-01-17",
        "value": 17.17
      },
      {
        "date": "2023-01-18",
        "value": 17.41
      },
      {
        "date": "2023-01-19",
        "value": 17.69
      },
      {
        "date": "2023-01-20",
        "value": 17.99
      },
      {
        "date": "2023-01-21",
        "value": 18.28
      },
      {
        "date": "2023-01-22",
        "value": 18.55
      },
      {
        "date": "2023-01-23",
        "value": 18.77
      },
      {
        "date": "2023-01-24",
        "value": 18.93
      },
      {
        "date": "2023-01-25",
        "value": 19.03
      },
      {
        "date": "2023-01-26",
        "value": 19.07
      },
      {
        "date": "2023-01-27",
        "value": 19.04
      },
      {
        "date": "2023-01-28",
        "value": 18.97
      },
      {
        "date": "2023-01-29",
        "value": 18.87
      },
      {
        "date": "2023-01-30",
        "value": 18.76
      },
      {
        "date": "2023-01-31",
        "value": 18.67
      },
      {
        "date": "2023-02-01",
        "value": 18.61
      },
      {
        "date": "2023-02-02",
        "value": 18.6
      },
      {
        "date": "2023-02-03",
        "value": 18.66
      },
      {
        "date": "2023-02-04",
        "value": 18.78
      },
      {
        "date": "2023-02-05",
        "value": 18.96
      },
      {
        "date": "2023-02-06",
        "value": 19.19
      },
      {
        "date": "2023-02-07",
        "value": 19.46
      },
      {
        "date": "2023-02-08",
        "value": 19.74
      },
      {
        "date": "2023-02-09",
        "value": 20.01
      },
      {
        "date": "2023-02-10",
        "value": 20.26
      },
      {
        "date": "2023-02-11",
        "value": 20.46
      },
      {
        "date": "2023-02-12",
        "value": 20.59
      },
      {
        "date": "2023-02-13",
        "value": 20.67
      },
      {
        "date": "2023-02-14",
        "value": 20.67
      },
      {
        "date": "2023-02-15",
        "value": 20.62
      },
      {
        "date": "2023-02-16",
        "value": 20.52
      },
      {
        "date": "2023-02-17",
        "value": 20.4
      },
      {
        "date": "2023-02-18",
        "value": 20.27
      },
      {
        "date": "2023-02-19",
        "value": 20.16
      },
      {
        "date": "2023-02-20",
        "value": 20.09
      },
      {
        "date": "2023-02-21",
        "value": 20.07
      },
      {
        "date": "2023-02-22",
        "value": 20.11
      },
      {
        "date": "2023-02-23",
        "value": 20.22
      },
      {
        "date": "2023-02-24",
        "value": 20.39
      },
      {
        "date": "2023-02-25",
        "value": 20.6
      },
      {
        "date": "2023-02-26",
        "value": 20.85
      },
      {
        "date": "2023-02-27",
        "value": 21.11
      },
      {
        "date": "2023-02-28",
        "value": 21.35
      },
      {
        "date": "2023-03-01",
        "value": 21.57
      },
      {
        "date": "2023-03-02",
        "value": 21.73
      },
      {
        "date": "2023-03-03",
        "value": 21.83
      },
      {
        "date": "2023-03-04",
        "value": 21.87
      },
      {
        "date": "2023-03-05",
        "value": 21.84
      },
      {
        "date": "2023-03-06",
        "value": 21.75
      },
      {
        "date": "2023-03-07",
        "value": 21.62
      },
      {
        "date": "2023-03-08",
        "value": 21.47
      },
      {
        "date": "2023-03-09",
        "value": 21.31
      },
      {
        "date": "2023-03-10",
        "value": 21.18
      },
      {
        "date": "2023-03-11",
        "value": 21.09
      },
      {
        "date": "2023-03-12",
        "value": 21.05
      },
      {
        "date": "2023-03-13",
        "value": 21.07
      },
      {
        "date": "2023-03-14",
        "value": 21.16
      },
      {
        "date": "2023-03-15",
        "value": 21.31
      },
      {
        "date": "2023-03-16",
        "value": 21.5
      },
      {
        "date": "2023-03-17",
        "value": 21.72
      },
      {
        "date": "2023-03-18",
        "value": 21.94
      },
      {
        "date": "2023-03-19",
        "value": 22.16
      },
      {
        "date": "2023-03-20",
        "value": 22.33
      },
      {
        "date": "2023-03-21",
        "value": 22.46
      },
      {
        "date": "2023-03-22",
        "value": 22.52
      },
      {
        "date": "2023-03-23",
        "value": 22.51
      },
      {
        "date": "2023-03-24",
        "value": 22.44
      },
      {
        "date": "2023-03-25",
        "value": 22.31
      },
      {
        "date": "2023-03-26",
        "value": 22.15
      },
      {
        "date": "2023-03-27",
        "value": 21.96
      },
      {
        "date": "2023-03-28",
        "value": 21.78
      },
      {
        "date": "2023-03-29",
        "value": 21.62
      },
      {
        "date": "2023-03-30",
        "value": 21.5
      },
      {
        "date": "2023-03-31",
        "value": 21.44
      }
    ],
    "actual": [
      {
        "date": "2023-04-01",
        "value": 21.44
      },
      {
        "date": "2023-04-02",
        "value": 21.5
      },
      {
        "date": "2023-04-03",
        "value": 21.62
      },
      {
        "date": "2023-04-04",
        "value": 21.78
      },
      {
        "date": "2023-04-05",
        "value": 21.97
      },
      {
        "date": "2023-04-06",
        "value": 22.17
      },
      {
        "date": "2023-04-07",
        "value": 22.34
      },
      {
        "date": "2023-04-08",
        "value": 22.48
      },
      {
        "date": "2023-04-09",
        "value": 22.56
      },
      {
        "date": "2023-04-10",
        "value": 22.58
      },
      {
        "date": "2023-04-11",
        "value": 22.53
      },
      {
        "date": "2023-04-12",
        "value": 22.41
      },
      {
        "date": "2023-04-13",
        "value": 22.25
      },
      {
        "date": "2023-04-14",
        "value": 22.04
      },
      {
        "date": "2023-04-15",
        "value": 21.82
      },
      {
        "date": "2023-04-16",
        "value": 21.61
      },
      {
        "date": "2023-04-17",
        "value": 21.42
      },
      {
        "date": "2023-04-18",
        "value": 21.27
      },
      {
        "date": "2023-04-19",
        "value": 21.19
      },
      {
        "date": "2023-04-20",
        "value": 21.16
      },
      {
        "date": "2023-04-21",
        "value": 21.21
      },
      {
        "date": "2023-04-22",
        "value": 21.3
      },
      {
        "date": "2023-04-23",
        "value": 21.44
      },
      {
        "date": "2023-04-24",
        "value": 21.59
      },
      {
        "date": "2023-04-25",
        "value": 21.75
      },
      {
        "date": "2023-04-26",
        "value": 21.89
      },
      {
        "date": "2023-04-27",
        "value": 21.99
      },
      {
        "date": "2023-04-28",
        "value": 22.03
      },
      {
        "date": "2023-04-29",
        "value": 22.0
      },
      {
        "date": "2023-04-30",
        "value": 21.91
      }
    ],
    "models": [
      {
        "id": "ensemble_weighted",
        "name": "Ensemble (weighted)",
        "predictions": [
          {
            "date": "2023-04-01",
            "value": 21.49
          },
          {
            "date": "2023-04-02",
            "value": 21.55
          },
          {
            "date": "2023-04-03",
            "value": 21.67
          },
          {
            "date": "2023-04-04",
            "value": 21.83
          },
          {
            "date": "2023-04-05",
            "value": 22.02
          },
          {
            "date": "2023-04-06",
            "value": 22.22
          },
          {
            "date": "2023-04-07",
            "value": 22.39
          },
          {
            "date": "2023-04-08",
            "value": 22.53
          },
          {
            "date": "2023-04-09",
            "value": 22.61
          },
          {
            "date": "2023-04-10",
            "value": 22.63
          },
          {
            "date": "2023-04-11",
            "value": 22.58
          },
          {
            "date": "2023-04-12",
            "value": 22.46
          },
          {
            "date": "2023-04-13",
            "value": 22.3
          },
          {
            "date": "2023-04-14",
            "value": 22.09
          },